outputs/maneuver_plan.json

[
  {
    "object": "0 STARLINK-34138",
    "target_object": "0 STARLINK-5872",
    "norad_id": 63971,
    "target_norad": 57232,
    "delta_v": [
      1336.7884375520364,
      700.6462081310424,
      895.2103202227963
    ],
    "magnitude": 1754.7962711308182,
    "maneuver_type": "prograde",
    "fuel_estimate": 224.62236815936086,
    "distance_km": 6.584,
    "tca_seconds": 221.9,
    "collision_probability": 47.24,
    "relative_velocity": 7.775,
    "risk_level": "HIGH"
  },
  {
    "object": "0 STARLINK-5872",
    "target_object": "0 STARLINK-34138",
    "norad_id": 57232,
    "target_norad": 63971,
    "delta_v": [
      1780.3518974446047,
      -80.03607155064255,
      -552.3882322589437
    ],
    "magnitude": 1865.7951148564048,
    "maneuver_type": "prograde",
    "fuel_estimate": 234.81856409124856,
    "distance_km": 6.584,
    "tca_seconds": 221.9,
    "collision_probability": 47.24,
    "relative_velocity": 7.775,
    "risk_level": "HIGH"
  },
  {
    "object": "0 STARLINK-35986",
    "target_object": "0 STARLINK-36054",
    "norad_id": 66853,
    "target_norad": 66812,
    "delta_v": [
      -1642.9325744661642,
      -744.161751167185,
      1451.9538675912129
    ],
    "magnitude": 2315.4209530353896,
    "maneuver_type": "prograde",
    "fuel_estimate": 272.4012971015212,
    "distance_km": 12.385,
    "tca_seconds": 383.7,
    "collision_probability": 0.0,
    "relative_velocity": 9.546,
    "risk_level": "MEDIUM"
  },
  {
    "object": "0 STARLINK-6320",
    "target_object": "0 STARLINK-4493",
    "norad_id": 57336,
    "target_norad": 53533,
    "delta_v": [
      -900.7632934706544,
      -1408.559394294513,
      267.5562613686163
    ],
    "magnitude": 1693.2219084092246,
    "maneuver_type": "prograde",
    "fuel_estimate": 218.79812689406026,
    "distance_km": 48.279,
    "tca_seconds": 660.6,
    "collision_probability": 0.0,
    "relative_velocity": 6.132,
    "risk_level": "MEDIUM"
  },
  {
    "object": "0 STARLINK-6320",
    "target_object": "0 STARLINK-32163",
    "norad_id": 57336,
    "target_norad": 60262,
    "delta_v": [
      -900.7632934706544,
      -1408.559394294513,
      267.5562613686163
    ],
    "magnitude": 1693.2219084092246,
    "maneuver_type": "prograde",
    "fuel_estimate": 218.79812689406026,
    "distance_km": 11.781,
    "tca_seconds": 230.3,
    "collision_probability": 0.0,
    "relative_velocity": 4.291,
    "risk_level": "MEDIUM"
  },
  {
    "object": "0 STARLINK-35993",
    "target_object": "0 STARLINK-35408",
    "norad_id": 66607,
    "target_norad": 65859,
    "delta_v": [
      1094.581760974563,
      -798.8353659628389,
      1118.691646322414
    ],
    "magnitude": 1757.1904202227802,
    "maneuver_type": "prograde",
    "fuel_estimate": 224.8463749703842,
    "distance_km": 28.738,
    "tca_seconds": 270.7,
    "collision_probability": 0.0,
    "relative_velocity": 10.82,
    "risk_level": "MEDIUM"
  },
  {
    "object": "0 STARLINK-36054",
    "target_object": "0 STARLINK-35986",
    "norad_id": 66812,
    "target_norad": 66853,
    "delta_v": [
      -1429.232362591069,
      -878.7456352396923,
      -1355.6805645270276
    ],
    "magnitude": 2157.027777003991,
    "maneuver_type": "prograde",
    "fuel_estimate": 259.8118199292132,
    "distance_km": 12.385,
    "tca_seconds": 383.7,
    "collision_probability": 0.0,
    "relative_velocity": 9.546,
    "risk_level": "MEDIUM"
  },
  {
    "object": "0 STARLINK-31884",
    "target_object": "0 STARLINK-31128",
    "norad_id": 59676,
    "target_norad": 58669,
    "delta_v": [
      -1560.4374316089736,
      -514.2811172481097,
      1321.353206656762
    ],
    "magnitude": 2108.417497144833,
    "maneuver_type": "prograde",
    "fuel_estimate": 255.81024766468923,
    "distance_km": 32.487,
    "tca_seconds": 1304.7,
    "collision_probability": 0.0,
    "relative_velocity": 3.74,
    "risk_level": "MEDIUM"
  },
  {
    "object": "0 STARLINK-31128",
    "target_object": "0 STARLINK-31884",
    "norad_id": 58669,
    "target_norad": 59676,
    "delta_v": [
      -2000.5178226446603,
      -136.4683349487347,
      472.6191619735946
    ],
    "magnitude": 2060.1126273646387,
    "maneuver_type": "prograde",
    "fuel_estimate": 251.7677790443405,
    "distance_km": 32.487,
    "tca_seconds": 1304.7,
    "collision_probability": 0.0,
    "relative_velocity": 3.74,
    "risk_level": "MEDIUM"
  },
  {
    "object": "0 STARLINK-30161",
    "target_object": "0 STARLINK-1300",
    "norad_id": 57476,
    "target_norad": 45374,
    "delta_v": [
      1936.137781818659,
      146.97454922336186,
      1147.7391202826295
    ],
    "magnitude": 2255.5567198659032,
    "maneuver_type": "prograde",
    "fuel_estimate": 267.7226389013307,
    "distance_km": 2.802,
    "tca_seconds": 2725.9,
    "collision_probability": 4.45,
    "relative_velocity": 0.472,
    "risk_level": "HIGH"
  },
  {
    "object": "0 LEGION 4",
    "target_object": "0 STARLINK-5233",
    "norad_id": 60453,
    "target_norad": 54160,
    "delta_v": [
      1459.4254705668575,
      666.954654370677,
      1325.9708770278835
    ],
    "magnitude": 2081.5739193821814,
    "maneuver_type": "prograde",
    "fuel_estimate": 253.57199700508508,
    "distance_km": 17.341,
    "tca_seconds": 340.4,
    "collision_probability": 0.0,
    "relative_velocity": 10.351,
    "risk_level": "MEDIUM"
  },
  {
    "object": "0 DELTA 2 R/B",
    "target_object": "0 STARLINK-37132",
    "norad_id": 25774,
    "target_norad": 68233,
    "delta_v": [
      509.1564601679289,
      818.5677636210622,
      685.976099033656
    ],
    "magnitude": 1183.1553968163926,
    "maneuver_type": "prograde",
    "fuel_estimate": 165.5634468529821,
    "distance_km": 45.738,
    "tca_seconds": 1930.3,
    "collision_probability": 0.0,
    "relative_velocity": 2.229,
    "risk_level": "MEDIUM"
  },
  {
    "object": "0 STARLINK-35408",
    "target_object": "0 STARLINK-35993",
    "norad_id": 65859,
    "target_norad": 66607,
    "delta_v": [
      733.8781964484683,
      -1036.7591033849997,
      -1467.8499834405584
    ],
    "magnitude": 1941.1414733502997,
    "maneuver_type": "prograde",
    "fuel_estimate": 241.52379974363885,
    "distance_km": 28.738,
    "tca_seconds": 270.7,
    "collision_probability": 0.0,
    "relative_velocity": 10.82,
    "risk_level": "MEDIUM"
  },
  {
    "object": "0 STARLINK-37132",
    "target_object": "0 DELTA 2 R/B",
    "norad_id": 68233,
    "target_norad": 25774,
    "delta_v": [
      356.9977596750111,
      678.8794475275978,
      950.9808281033958
    ],
    "magnitude": 1221.756620652646,
    "maneuver_type": "prograde",
    "fuel_estimate": 169.92284825847014,
    "distance_km": 45.738,
    "tca_seconds": 1930.3,
    "collision_probability": 0.0,
    "relative_velocity": 2.229,
    "risk_level": "MEDIUM"
  },
  {
    "object": "0 STARLINK-32163",
    "target_object": "0 STARLINK-6320",
    "norad_id": 60262,
    "target_norad": 57336,
    "delta_v": [
      -1944.9371065798885,
      -1172.7921454472228,
      -630.2340973869416
    ],
    "magnitude": 2356.993165557164,
    "maneuver_type": "prograde",
    "fuel_estimate": 275.59479165115204,
    "distance_km": 11.781,
    "tca_seconds": 230.3,
    "collision_probability": 0.0,
    "relative_velocity": 4.291,
    "risk_level": "MEDIUM"
  },
  {
    "object": "0 STARLINK-35071",
    "target_object": "0 STARLINK-32400",
    "norad_id": 65477,
    "target_norad": 61669,
    "delta_v": [
      -1446.0055142472909,
      -252.34583850018544,
      1400.0530626179902
    ],
    "magnitude": 2028.4868615763692,
    "maneuver_type": "prograde",
    "fuel_estimate": 249.08494600107966,
    "distance_km": 4.131,
    "tca_seconds": 174.0,
    "collision_probability": 100.0,
    "relative_velocity": 10.988,
    "risk_level": "HIGH"
  },
  {
    "object": "0 STARLINK-32400",
    "target_object": "0 STARLINK-35071",
    "norad_id": 61669,
    "target_norad": 65477,
    "delta_v": [
      -1100.6181527507658,
      1040.4817456390253,
      -1106.9287137238393
    ],
    "magnitude": 1875.967419343645,
    "maneuver_type": "prograde",
    "fuel_estimate": 235.7338777484893,
    "distance_km": 4.131,
    "tca_seconds": 174.0,
    "collision_probability": 100.0,
    "relative_velocity": 10.988,
    "risk_level": "HIGH"
  },
  {
    "object": "0 STARLINK-30353",
    "target_object": "0 STARLINK-35276",
    "norad_id": 58113,
    "target_norad": 66009,
    "delta_v": [
      -573.9962895369783,
      1554.6389771197269,
      313.3640963304079
    ],
    "magnitude": 1686.585647529073,
    "maneuver_type": "prograde",
    "fuel_estimate": 218.1631036231836,
    "distance_km": 16.1,
    "tca_seconds": 86.0,
    "collision_probability": 0.0,
    "relative_velocity": 7.218,
    "risk_level": "MEDIUM"
  },
  {
    "object": "0 STARLINK-1300",
    "target_object": "0 STARLINK-30161",
    "norad_id": 45374,
    "target_norad": 57476,
    "delta_v": [
      1688.6164858340117,
      -55.77531604474997,
      1227.8461665270258
    ],
    "magnitude": 2088.5743297200156,
    "maneuver_type": "prograde",
    "fuel_estimate": 254.157669771991,
    "distance_km": 2.802,
    "tca_seconds": 2725.9,
    "collision_probability": 4.45,
    "relative_velocity": 0.472,
    "risk_level": "HIGH"
  },
  {
    "object": "0 STARLINK-35276",
    "target_object": "0 STARLINK-30353",
    "norad_id": 66009,
    "target_norad": 58113,
    "delta_v": [
      -1473.4941272832348,
      750.5690102738432,
      -826.0310632503388
    ],
    "magnitude": 1848.4766971147144,
    "maneuver_type": "prograde",
    "fuel_estimate": 233.25293713596113,
    "distance_km": 16.1,
    "tca_seconds": 86.0,
    "collision_probability": 0.0,
    "relative_velocity": 7.218,
    "risk_level": "MEDIUM"
  },
  {
    "object": "0 STARLINK-5233",
    "target_object": "0 LEGION 4",
    "norad_id": 54160,
    "target_norad": 60453,
    "delta_v": [
      1609.9179233745579,
      -263.14633691773554,
      -1321.3120186703068
    ],
    "magnitude": 2099.273008762432,
    "maneuver_type": "prograde",
    "fuel_estimate": 255.05006135908422,
    "distance_km": 17.341,
    "tca_seconds": 340.4,
    "collision_probability": 0.0,
    "relative_velocity": 10.351,
    "risk_level": "MEDIUM"
  },
  {
    "object": "0 STARLINK-4493",
    "target_object": "0 STARLINK-6320",
    "norad_id": 53533,
    "target_norad": 57336,
    "delta_v": [
      -137.48819230439904,
      -1172.2072669647707,
      1293.3564670772091
    ],
    "magnitude": 1750.9265634739193,
    "maneuver_type": "prograde",
    "fuel_estimate": 224.25991612649307,
    "distance_km": 48.279,
    "tca_seconds": 660.6,
    "collision_probability": 0.0,
    "relative_velocity": 6.132,
    "risk_level": "MEDIUM"
  }
]

outputs/final_report.md

### #1: 0 STARLINK-32400 ↔ 0 STARLINK-35071

- **Decision:** EXECUTE MANEUVER
- **Risk Level:** HIGH
- **Distance:** 4.131 km
- **TCA:** 174.0 seconds (2.9 minutes)
- **Fuel Required:** 235.73 kg
- **Confidence:** 0.95
- **Anomalies:** high_fuel_requirement

### #2: 0 STARLINK-35071 ↔ 0 STARLINK-32400

- **Decision:** EXECUTE MANEUVER
- **Risk Level:** HIGH
- **Distance:** 4.131 km
- **TCA:** 174.0 seconds (2.9 minutes)
- **Fuel Required:** 249.08 kg
- **Confidence:** 0.95
- **Anomalies:** high_fuel_requirement

### #3: 0 STARLINK-30353 ↔ 0 STARLINK-35276

- **Decision:** MONITOR
- **Risk Level:** MEDIUM
- **Distance:** 16.100 km
- **TCA:** 86.0 seconds (1.4 minutes)
- **Fuel Required:** 218.16 kg
- **Confidence:** 0.60
- **Anomalies:** high_fuel_requirement

### #4: 0 STARLINK-35276 ↔ 0 STARLINK-30353

- **Decision:** MONITOR
- **Risk Level:** MEDIUM
- **Distance:** 16.100 km
- **TCA:** 86.0 seconds (1.4 minutes)
- **Fuel Required:** 233.25 kg
- **Confidence:** 0.60
- **Anomalies:** high_fuel_requirement

### #5: 0 STARLINK-34138 ↔ 0 STARLINK-5872

- **Decision:** EXECUTE MANEUVER
- **Risk Level:** HIGH
- **Distance:** 6.584 km
- **TCA:** 221.9 seconds (3.7 minutes)
- **Fuel Required:** 224.62 kg
- **Confidence:** 0.95
- **Anomalies:** high_fuel_requirement